WORD; DERIVATIVES; DEFINITION;
tower; [towers]; a tall building or part of a building, usually skinny and round;
town; [towns]; a small city with streets and buildings;
toy; [toys]; things kids like to play with;
tracks; [track]; the metal rails that train wheels roll on; or marks made by feet or paws;
train; [trains, train-of-cars]; the cars and locomotive that roll on rails;
travel; [travels, travelled, travelling]; to go somewhere, usually far away;
traveler; ; someone who goes far away;
treasure; [treasures]; something worth lots and lots of money;
treasury; ; a place to keep lots and lots of money and special things;
tree; [trees]; plants with trunks that can grow taller than people;
tremble; [trembles, trembled, trembling]; to make jerky little skin movements when afraid or cold;
trick; [tricks, tricked, tricking]; tricky, to fool someone, have them make a mistake ;
tricycle; [tricycles]; a toy with one big and two smaller wheels little kids like to ride on ;
trot; [trots, trotted, trotting]; when a horse runs a little fast, but not as fast as a canter or gallop ;
try; [tries, tried, trying]; to make an effort or attempt to do something ;
trunk; [trunks]; the thickest tree part; or the long nose of an elephant ;
tuck; [tucks, tucked, tucking]; to tighten the edges underneath, especially blankets ;
tuffet; ; a low seat like a footstool;
tug; [tugs, tugged, tugging]; to pull in jerky stops and starts;
tumble; [tumbles, tumbled, tumbling]; to fall and roll over ;
tummy; [tummies]; belly or stomach;
tunnel; [tunnels]; a long hole in the ground, sometimes big enough for people to move through ;
turkey; [turkeys]; a bird, bigger than a chicken, with a big tail;
turn; [turns, turned, turning]; move around;
tv; ; television;
twig; [twigs]; a very small branch from a tree, not bigger than your finger ;
twist; [twists, twisted, twisting]; wrap around;
twisty; ; wrapped around or bent;
twitch; [twitches, twitched, twitching]; to make  quick little movements without meaning to;
umbrella; [umbrellas]; something to hold to keep from getting wet in the rain;
underneath; ; below;
uneasy; ; worried;
unfortunate; [unfortunately]; unhappy, unlucky or something bad happened;
unhappiness; ; sadness;
unhappy; ; sad;
unicorn; [unicorns]; like a horse with a sharp horn on the forehead;
unicycle; [unicycles]; like a bicycle but with only one wheel;
uniforms; [uniform]; clothes worn by many people that look just the same  ;
upper; ; higher;
upset; [upsets, upsetting]; to make something fall over; or make someone unhappy;
upside; [the top]; ‘upside down’ means the top is at the bottom, and the bottom on top;
useless; ; no good, not good for anything  ;
usual; ; normal or common or ordinary;
usually; ; most of the time;
vain; [vainer, vainest]; people who think they are better than others or can mean ‘worthless’;
van; [vans]; a vehicle like a small bus;
vegetables; [vegetable]; foods like carrots and peas and beans;
vehicles; [vehicle]; things on wheels like cars, trucks, busses;
velvet; ; a soft, smooth cloth;
village; [villages]; a very small town;
villagers; ; people who live in a very small town;
voice; [voices]; the sound when someone speaks;
volcano; [volcanos, volcanoes]; a mountain with fire inside that sometimes explodes;
wad; [wads, wadded]; tight like paper or gum all pushed together;
waddle; [waddles, waddled, waddling]; step moving a little sideways like a duck ;
wagons; [wagon]; small ones are toys, larger ones like train cars carry heavy things;
wait; [waits, waited, waiting]; stay till something happens  ;
wake; [wakes, waked, woke, waking]; to stop sleeping;
wall; [walls]; a side of a room; in a yard mostly a long stack of bricks or stones ;
wander; [wanders, wandered, wandering]; to go away just anywhere, no place special;
warm; [warmer, warmest]; less than hot;
wasn’t; ; was not;
water; ; wet stuff you can see through and can drink when it’s clean;
water-ditch; ; a low place with water inside, usually beside a road, sometimes outside a castle; 
water-cans; ; used to carry and pour water to help plants grow;
wave; ; to move hands or something else in the air;
waves; ; moves something in the air or the curvy, splashy parts of water that move up and down;
we’ll; ; we will;
ever; ; at any time or all times;
tell; [tell, tells, told, telling]; to say something, to give a message to someone, or sometimes can mean a small action or look that gives away what you’re thinking;
meet; [meets, met, meeting]; when people come together;
remember; [remembers, remembered, remembering]; to think about things that happened;
ignorant;;ignorant, ignorance]; not knowing something, being unaware;
weak; [weaker, weakest]; not strong  ;
wealth; [wealthy]; having lots of money;
thus; ; ‘in this way’ or  ‘so’ or ‘for this reason';
appear; [appears, appeared, appearing]; can be seen;
appease; [appeases, appeased, appeasing; to make happy], satisfied;
appetite; [appetites]; wanting to eat;
apple; [apples]; yummy round fruit, usually red or yellow;
April; ; a month in spring time, on the first day people trick other people;
apron; [aprons]; a cloth worn around the front to keep clothes clean;
arm; [arms]; from your shoulder to your hand;
around; ; near, or outside of;
arrant; ; not following the rules, naughty;
wink; [winks, winked, winking]; to quickly close and open an eye;
wipe; [wipes, wiped, wiping]; to move something across, usually to make something dry;
wisely; ; in a very smart way;
labor; [labor, labors, labored, laboring, laborer]; work, or to do work;
wise; [wiser, wisest]; very smart, knowing many things;
witch; [witches]; a pretend mean old woman who does bad magic;
without; ; not to have;
woke; ; stopped sleeping;
wolf; [wolves]; a wild animal that looks like a big, mean dog;
woman; ; a grown-up girl;
women; ; more than one woman;
field; [fields]; an open piece of ground where grass or small plants can grow;
won’t; ; will not;
wonder; [wonders, wondered, wondering]; to think about something that might be;
wonderful; [wonderfulest]; very good, excellent, terrific, awesome, fabulous, brilliant;
wonderfully; ; do really well, very much in a very good way;
wooden; ; made of wood;
woods; ; a place with many trees;
wool; [wooly]; the fluffy hair from sheep fur;
word; [words]; a sound that means something, that we read or speak with;
world; [worlds]; everything under the sky;
worry; [worries, worried, worrying]; to feel bothered or annoyed or troubled;
wouldn’t; ; would not;
wow; [wowie-wow, wowee-wowishous-wow, wowee-wowishously-wow-wow]; said when people are surprised or very happy;
wrap; [wraps, wrapped, wrapping]; to put around the outside of something;
wriggle; [wriggles, wriggled, wriggling]; to move like a worm, in little jerky movements;
wrong; ; not right, incorrect, mistaken;
concern; [concern, concerns, concerned, concerning]; worry, or to be worried;
own; [own, owns, owned, owning; owner, owners];something belongs to someone or something;
yarn; [yarns]; long string made of wool;
childhood; [childhood, childhoods]; the time when a person is young;
during; ; time going by while something happens;
even; ; including, this too, or sometimes means the same amount;
life; ; able to live, or how long someone lives;
time;[time, times, timed, timing]; the period of minutes, days, weeks, years when things happen;
misery;  [unhappiness, misery, miseries; miserable]; suffering, feeling especially bad pain, sadness, or unhappiness;
source; [sources]; the place something comes from; sometimes a cause or starting point;
information; ; facts, knowledge; things useful to know;
opinion; [opinions]; an idea about something, sometimes an evaluation of something;
mother; [momma, mommy]; a woman who loves you;
parentage; ; someone’s ancestors or antecedents, a line of parents going back in time;
yawn; [yawns, yawned, yawning]; to open the mouth wide, usually when feeling sleepy;
year; [years]; a long time, the time between two birthdays;
hear; [hears, heard, hearing]; what your ears do;
speak; [speaks, spoke, speaking, spoken]; to say;
yell; [yells, yelled, yelling]; say in a very loud voice, to shout;
yellow; [yellower, yellowest]; the color of ripe bananas;
yesterday; ; the day before today;
yet; ;still, till now;
fall-time; [fall-times]; the season after summer, autumn;
you’re; ; you are;
spring-time; ; after winter-time, when weather is warmer and many flowers and other plants blossom;
harvest-time; ; ;
cherry-time; ; springtime, when cherry trees blossom;
planting-time; ; usually in the spring when seeds are planted in the ground;
seldom; ; not often;
colored; ; having color, an old, offensive term for some people with dark skins;
than; ; a word to help say two things are different;
quite; ; very much;
dark; [dark, darker, darkest, darkness]; lacking light, often gloomy, can mean hard to understand or mysterious;
young; [younger, youngest]; not old;
yourself; ;you;
daughter; [daughters]; the girl child of a father or mother;
yucky; ; icky, not nice, unpleasant;
zoo; ; a place to come visit many kinds of animals;
Aliciana; [Amanda, Andrew, Anna, Anthony, Augustus, Austin, Auld, Bailey, Barney, Beal, Betsey, Betsy, Bowley, Caldwell, Caroline, Charles, Cookman, Covey, Curtis, Daniel, David, Dearborn, Demby, Dodson, Douglass, Edward, Eli, Eliza, Fairbanks, Freddy, Frederick, Freeland, George, Giles, Gore, Graham, Hamilton, Harriet, Harris, Harrison, Hester, Henny, Henrietta, Henry, Hick, Hickey, Hicks, Hopkins, Hugh, Hughes, Humphry, Isaac, Jacob, Jake, James, January, Jenkins, Jepson, John, Johnson, Joseph, Kemp, Lee, Lespenard, Lloyd, Lowe, Lucretia, Mary, Michaels, Murray, Nathan, Ned, Nicholson, Patrick, Pennington, Peter, Philpot, Plummer, Priscilla, Rigby, Ricketson, Richard, Roberts, Rowe, Rowena, Ruggles, Samuel, Sally, Severe, Shaw, Sheridan, Slater, Smith, Sophia, Stanley, Stewart, Thomas, Tom, Townsend, Walter, Watson, Wilk, Wilkes, William, Willis. Wilson, Wright]; a name;